{
  "kind": "cineweave_codex_interaction_constraint_set",
  "contractVersion": "2.0.0",
  "worldId": "world-cloud-dynasty",
  "interactionSetId": "interaction.shot-12-corridor",
  "shotId": "scene-02-shot-12",
  "skillReceipt": {
    "repository": "https://github.com/Wilder1222/cineweave-director",
    "ref": "v3.1.0",
    "commit": "0123456789abcdef0123456789abcdef01234567",
    "contentHash": "sha256:aaaaaaaaaaaaaaaaaaaaaaaaaaaaaaaaaaaaaaaaaaaaaaaaaaaaaaaaaaaaaaaa",
    "installedBy": "codex-environment",
    "usedAt": "2026-08-20T18:00:00.000Z"
  },
  "characterBindingRefs": [
    {
      "bindingId": "binding.char-shot-12-shen",
      "contentHash": "sha256:ffffffffffffffffffffffffffffffffffffffffffffffffffffffffffffffff"
    }
  ],
  "sceneBindingRef": {
    "bindingId": "binding.scene-shot-12-corridor",
    "contentHash": "sha256:7777777777777777777777777777777777777777777777777777777777777777"
  },
  "constraints": {
    "contacts": [
      {
        "contactId": "contact.shen-floor",
        "subjectBindingId": "binding.char-shot-12-shen",
        "subjectPart": "both_feet",
        "targetType": "ground",
        "targetRef": "anchor.floor-stone",
        "relation": "standing_on",
        "pressure": "moderate",
        "duration": "shot",
        "required": true
      },
      {
        "contactId": "contact.shen-child-shield",
        "subjectBindingId": "binding.char-shot-12-shen",
        "subjectPart": "left_forearm",
        "targetType": "character",
        "targetRef": "binding.char-shot-12-child",
        "relation": "shielding",
        "pressure": "light",
        "duration": "beat",
        "required": true
      }
    ],
    "supports": [
      {
        "subjectBindingId": "binding.char-shot-12-shen",
        "supportTargetRef": "anchor.floor-stone",
        "supportedParts": [
          "右脚承担大部分重量",
          "左脚稳定后退"
        ],
        "weightDistribution": "约六成重量在右脚，四成在后撤的左脚。",
        "centerOfGravity": "骨盆下沉但保持在双脚支撑多边形内。"
      }
    ],
    "occlusions": [
      {
        "frontRef": "prop.pursuer-weapon",
        "backRef": "binding.char-shot-12-shen",
        "region": "左前景遮挡人物左肩边缘",
        "ordering": "front_before_back"
      },
      {
        "frontRef": "binding.char-shot-12-shen",
        "backRef": "binding.char-shot-12-child",
        "region": "人物身体遮挡孩子胸口与下半身",
        "ordering": "front_before_back"
      }
    ],
    "lightingResponse": [
      {
        "subjectBindingId": "binding.char-shot-12-shen",
        "keySourceRef": "light.window-southwest",
        "castShadowOn": "anchor.floor-stone",
        "contactShadow": "双脚与石地保持短而清晰的接触阴影。",
        "bounceSource": "material.white-jade-rail",
        "exposureRelation": "人物面部略亮于走廊背景但不脱离环境。"
      }
    ],
    "environmentResponse": [
      {
        "subjectBindingId": "binding.char-shot-12-shen",
        "driver": "wind",
        "direction": "西南至东北",
        "intensity": 0.35,
        "hairEffect": "少量碎发向东北偏移。",
        "garmentEffect": "衣摆与披帛轻微延迟摆动，不遮挡双脚。",
        "skinEffect": "无明显影响。"
      }
    ],
    "propInteractions": [
      {
        "interactionId": "interaction.sword-ready",
        "subjectBindingId": "binding.char-shot-12-shen",
        "propRef": "prop.sword-shen",
        "handOrBodyPart": "right_hand",
        "grip": "手指尚未完全闭合，只接近剑柄。",
        "action": "准备但不拔剑。",
        "continuityState": "剑仍在右侧剑鞘中，下一镜头若拔出需明确动作触发。"
      }
    ]
  },
  "preserve": [
    "人物位于孩子与追兵之间",
    "双脚真实承重",
    "右手惯用侧和剑的位置",
    "走廊光源方向"
  ],
  "allowedDeviations": [
    "前景武器裁切",
    "风引起的发丝与衣摆小幅变化"
  ],
  "forbiddenChanges": [
    "悬浮脚",
    "错误遮挡顺序",
    "无接触的手部抓握",
    "影子方向与光源冲突"
  ],
  "validation": {
    "bindingRefsResolved": true,
    "contactsGrounded": true,
    "occlusionAcyclic": true,
    "lightingMotivated": true,
    "propContinuityExplicit": true
  },
  "provenance": {
    "source": "codex_authored",
    "createdAt": "2026-08-20T18:00:00.000Z",
    "updatedAt": "2026-08-20T18:00:00.000Z",
    "changeLog": [
      "v1：绑定人物接触、遮挡、光线及环境响应"
    ]
  }
}
